content,score,sentiment_label,sentiment_rating,wordCount,review_without_stopwords,wordCount_after_stopwords,review_stem_without_stopwords
aplikasi ini tidak akurat. saya pilih dokter a justru yang muncul terakhir dokter z (yang ratingnya rendah). tolong diperbaiki. harusnya benar-benar bisa menanggulangi kesalahan ini.,1,neutral,negative,31,aplikasi akurat pilih dokter a muncul dokter z ratingnya rendah tolong diperbaiki benarbenar menanggulangi kesalahan,15,aplikasi akurat pilih dokter a muncul dokter z ratingnya rendah tolong baik benarbenar tanggulang salah
mungkin bisa lebih murah lagi,4,neutral,positive,5,murah,1,murah
dokternya fast respon .keren banget,5,neutral,positive,5,dokternya fast respon keren,4,dokter fast respon keren
"baiknya fitur untuk ganti pembayaran tersedia bisa diubah seperti di e-commerce, misalnya kita salah klik pembayaran yang harusnya mau pake shopeepay malah tidak sengaja klik pembayaran bank yaa otomatis gabisa ganti metode bayarnya ke shopeepay karena gaada fitur nya",2,negative,negative,40,baiknya fitur ganti pembayaran tersedia diubah ecommerce salah klik pembayaran pake shopeepay sengaja klik pembayaran bank yaa otomatis gabisa ganti metode bayarnya shopeepay gaada fitur,25,baik fitur ganti bayar sedia ubah ecommerce salah klik bayar pake shopeepay sengaja klik bayar bank yaa otomatis gabisa ganti metode bayar shopeepay gaada fitur
"terimakasih, sangat membantu jawabannya",5,negative,positive,5,terimakasih membantu jawabannya,3,terimakasih bantu jawab
rama doktenya,5,neutral,positive,2,rama doktenya,2,rama doktenya
sangat sangat puas,5,neutral,positive,3,puas,1,puas
sangat2 membantu disaat genting,5,neutral,positive,4,sangat2 membantu disaat genting,4,sangat2 bantu saat genting
"baik, responsif & sangat jelas penjelasannya",5,negative,positive,7,responsif penjelasannya,2,responsif jelas
semoga bisa bejerjasama,3,negative,neutral,3,semoga bejerjasama,2,moga bejerjasama
"udh download tapi ga bisa akses gmna ya ? ko bisa gitu ? apk nya ga bisa masuk, di tungguin udh lama juga tatap layar biru alodokter teruss",1,positive,negative,29,udh download akses gmna ko gitu apk masuk tungguin udh tatap layar biru alodokter teruss,15,udh download akses gmna ko gitu apk masuk tungguin udh tatap layar biru alodokter teruss
"dokternya cepat tanggap,jelas",5,negative,positive,5,dokternya cepat tanggapjelas,3,dokter cepat tanggapjelas
"biaya konsultasi awal ke dokter umum lebih murah dibanding apk sebelah. banyak opsi pembayaran. tapi setelah bayar, gw sempat bingung dimana carinya buat klik chat dokter. setelah berhasil, dikasih dokter random yg sangat lama sekali balas chat. harus menunggu lebih dari setengah jam hanya untuk balasan singkat. akhirnya dapat resep tapi tololnya dikirim dari apotek k24 yg sangat jauh lokasinya dan pengiriman reguler. harus cari sendiri dan ga ada dijual apotek lain. adek gw muter2 sampe jengkel",3,neutral,neutral,86,biaya konsultasi dokter murah dibanding apk sebelah opsi pembayaran bayar gw bingung dimana carinya klik chat dokter berhasil dikasih dokter random balas chat menunggu jam balasan singkat resep tololnya dikirim apotek k24 lokasinya pengiriman reguler cari dijual apotek adek gw muter2 sampe jengkel,43,biaya konsultasi dokter murah banding apk belah opsi bayar bayar gw bingung mana cari klik chat dokter hasil kasih dokter random balas chat tunggu jam balas singkat resep tolol kirim apotek k24 lokasi kirim reguler cari jual apotek adek gw muter2 sampe jengkel
sangat bermanfaat,4,negative,positive,2,bermanfaat,1,manfaat
"pengalaman terburuk belik obat disini, udh siap konsul udh dikirim paket tapi kurir nya gk dtg dtg sampek 3 hari, padahal di pilih same day malah di bikin pula udh sampai padahal belum nerima, kurir antar aja se enak nya aja , nyesal lah ,setelah ini langsung di unistal",1,positive,negative,53,pengalaman terburuk belik obat udh konsul udh dikirim paket kurir gk dtg dtg sampek 3 pilih same day bikin udh nerima kurir enak nyesal langsung unistal,26,alam buruk belik obat udh konsul udh kirim paket kurir gk dtg dtg sampek 3 pilih same day bikin udh nerima kurir enak nyesal langsung unistal
"untuk pengiriman obat baiknya opsi pengirimanya d pilih oleh kami/pembeli, ini kan lebih baik, karna pembeli akan lebih tau layanan jasa mana yg lebih baik di daerahnya dan biar tidak terjadi barang kembali/retur, semoga alodokter semakin sukses dan propesional.",5,negative,positive,43,pengiriman obat baiknya opsi pengirimanya d pilih kamipembeli karna pembeli tau layanan jasa daerahnya biar barang kembaliretur semoga alodokter sukses propesional,21,kirim obat baik opsi pengirimanya d pilih kamipembeli karna beli tau layan jasa daerah biar barang kembaliretur moga alodokter sukses propesional
terima kasih telah membantu sy,5,positive,positive,5,terima kasih membantu sy,4,terima kasih bantu sy
ingin mlencoba,4,negative,positive,2,mlencoba,1,mlencoba
jawabannya cukup puas trimakasih dokter,5,negative,positive,5,jawabannya puas trimakasih dokter,4,jawab puas trimakasih dokter
murah dan jelas,5,positive,positive,3,murah,1,murah
respon dokter sangat cepat dan bagus,4,negative,positive,6,respon dokter cepat bagus,4,respon dokter cepat bagus
pelayanan ditingkatkan trs yaa,5,negative,positive,4,pelayanan ditingkatkan trs yaa,4,layan tingkat trs yaa
"ya allah.. saya ke psikolog namun karena tidak cek ""jadwal profesional"" (kata si psikolog), saya cuma konsul 20 menit itu juga dibalesnya lama  psikolognya gak nyambung. ditanya apa jawab apa?? ehh trs dia tanya sudah mudeng gak? saya jawab aja belum tapi gpp kata saya. ehh dia minta apa yang bingung katanya? saya jawab tentang xx. ehh dia bilang itu bkn kewenangan dia buat ngasih tau sbg psikolog. sejak 23 februari 2024 sampai hari ini eskalasi cs alodokter sangat lambat. sangat mengecewakan!",1,neutral,negative,98,allah psikolog cek jadwal profesional si psikolog konsul 20 menit dibalesnya psikolognya nyambung ehh trs mudeng gpp ehh bingung xx ehh bilang bkn kewenangan ngasih tau sbg psikolog 23 februari 2024 eskalasi cs alodokter lambat mengecewakan,36,allah psikolog cek jadwal profesional si psikolog konsul 20 menit dibalesnya psikolog nyambung ehh trs mudeng gpp ehh bingung xx ehh bilang bkn wenang ngasih tau sbg psikolog 23 februari 2024 eskalasi cs alodokter lambat kecewa
"ini tidak membantu,kami yg tidak sanggup membayar otomatis tidak bisa pakai apk trsebut.tolong di ubah agar gratis untuk cht dokter tersebut,kculi kita semua sama2 ada penghasilan tidak mslh soal pembayaran,blum tentu orng lain sanggup, terimah kasih semoga ada perubahan dan semoga cpt di atasi. mohon maaf sebelumnya",1,neutral,negative,55,membantukami sanggup membayar otomatis pakai apk trsebuttolong ubah gratis cht dokter tersebutkculi sama2 penghasilan mslh pembayaranblum orng sanggup terimah kasih semoga perubahan semoga cpt atasi mohon maaf,27,membantukami sanggup bayar otomatis pakai apk trsebuttolong ubah gratis cht dokter tersebutkculi sama2 hasil mslh pembayaranblum orng sanggup terimah kasih moga ubah moga cpt atas mohon maaf
dengan ada nya aodokter sangat menbantu trima kasih sudah membatu pembelian obat nya,5,positive,positive,13,aodokter menbantu trima kasih membatu pembelian obat,7,aodokter menbantu trima kasih batu beli obat
hapus aja apknya,1,negative,negative,3,hapus apknya,2,hapus apknya
sangat puas,5,neutral,positive,2,puas,1,puas
"terimakasih, infonya sangat membantu kami",5,negative,positive,6,terimakasih infonya membantu,3,terimakasih info bantu
dokter sangat sabar dan sangat jelas ,5,negative,positive,6,dokter sabar,2,dokter sabar
gimana sih rugi dong gue bayar 3 kali masa kaga ada yang di respon bisa duit gue di balikin aja konsul aja kaga pengembalian duit kalo ada yang mau donload jangan deh mending halo doc aja cepat respon kaga kaya aplikasi ini mau duit nya doang,1,neutral,negative,46,gimana sih rugi gue bayar 3 kali kaga respon duit gue balikin konsul kaga pengembalian duit kalo donload deh mending halo doc cepat respon kaga kaya aplikasi duit doang,29,gimana sih rugi gue bayar 3 kali kaga respon duit gue balikin konsul kaga kembali duit kalo donload deh mending halo doc cepat respon kaga kaya aplikasi duit doang
dokter sangat ramah banget,5,neutral,positive,4,dokter ramah,2,dokter ramah
jelas dan faham terima kasih,5,positive,positive,5,faham terima kasih,3,faham terima kasih
dokternya baik,5,negative,positive,2,dokternya,1,dokter
makasih dok,5,neutral,positive,2,makasih,1,makasih
"respon cepat sekali dokternya, dan ramah",5,negative,positive,7,respon cepat dokternya ramah,4,respon cepat dokter ramah
bagus pelayanan nya,5,neutral,positive,3,bagus pelayanan,2,bagus layan
"konsul ke dokter zaman skarang gak ada yang gratis, harus bayar.",1,positive,negative,13,konsul dokter zaman skarang gratis bayar,6,konsul dokter zaman skarang gratis bayar
terimakasih dokter martinus satya gani . semoga dokter sehat selalu..aamiiin,5,positive,positive,12,terimakasih dokter martinus satya gani semoga dokter sehat selaluaamiiin,9,terimakasih dokter martinus satya gani moga dokter sehat selaluaamiiin
good,5,neutral,positive,1,good,1,good
kenapa setiap mau liat riwayat pembelian obat selalu lemot??? tolong diperbaiki sekelas alodok kok begini,2,neutral,negative,18,liat riwayat pembelian obat lemot tolong diperbaiki sekelas alodok,9,liat riwayat beli obat lot tolong baik kelas alodok
"buset lambat banget aplikasi ny lgi full trafic apa emng aplikasi sampah, padahal buka aplikasi lain lancar banget",1,neutral,negative,19,buset lambat aplikasi ny lgi full trafic emng aplikasi sampah buka aplikasi lancar,13,buset lambat aplikasi ny lgi full trafic emng aplikasi sampah buka aplikasi lancar
dokternya ramah,5,negative,positive,2,dokternya ramah,2,dokter ramah
terima kasih dokter,5,neutral,positive,3,terima kasih dokter,3,terima kasih dokter
bagus tapi ngga kaya dulu skrg chat sama dokter umum nya bayar.. duluugratis,5,neutral,positive,14,bagus ngga kaya skrg chat dokter bayar duluugratis,8,bagus ngga kaya skrg chat dokter bayar duluugratis
"aplikasi ini sangat berharga buat saya, sudah bertahun tahun langganan di alodok, sangat terjangkau, tpi tolong lebih dibanyakin dokternyat y",5,positive,positive,23,aplikasi berharga bertahun langganan alodok terjangkau tpi tolong dibanyakin dokternyat y,11,aplikasi harga tahun langgan alodok jangkau tpi tolong dibanyakin dokternyat y
good,5,neutral,positive,1,good,1,good
selalu puas dengan alodokter,5,neutral,positive,4,puas alodokter,2,puas alodokter
mntap,5,neutral,positive,1,mntap,1,mntap
tq dok,5,positive,positive,2,tq,1,tq
sangat menginformasikan,5,neutral,positive,2,menginformasikan,1,informasi
"diresepin obat dan transaksi ditanggal 10, hari ini tanggal 16 paket obat belum juga sampai. dari yang hanya benjolan di kepala sampai muncul benjolan di payudara sampai sesak, tulang rusuk sakit sampai sembuh sendiri obatnya belum juga tiba. haha lawak sekali layanan ini",1,negative,negative,47,diresepin obat transaksi ditanggal 10 tanggal 16 paket obat benjolan kepala muncul benjolan payudara sesak tulang rusuk sakit sembuh obatnya haha lawak layanan,23,diresepin obat transaksi tanggal 10 tanggal 16 paket obat benjol kepala muncul benjol payudara sesak tulang rusuk sakit sembuh obat haha lawak layan
terbaik,5,neutral,positive,1,terbaik,1,baik
sangat suka dengan pelayanan cari obat di alodokter sangat membantu,5,negative,positive,10,suka pelayanan cari obat alodokter membantu,6,suka layan cari obat alodokter bantu
bagus,4,neutral,positive,1,bagus,1,bagus
"sangat bermanfaat karena saat kerja pun dapat berkonsultasi tanpa perlu antri ke tempat praktek, para dokter yg tergabung juga sangat baik dan gercep (gerak cepat) dalam menjawab..terima kasih alodokter",5,neutral,positive,34,bermanfaat kerja berkonsultasi antri praktek dokter tergabung gercep gerak cepat menjawabterima kasih alodokter,13,manfaat kerja konsultasi antri praktek dokter gabung gercep gerak cepat menjawabterima kasih alodokter
"ga worth it kata aku konsultasi online, karna diagnosa tidak akurat sama sekali, jawaban dokter tergesa gesa dan seperti template robot, ya bisa dimaklumi karna biaya konsultasi dokter spesialisnya pun murah.",3,neutral,neutral,35,worth it konsultasi online karna diagnosa akurat dokter tergesa gesa template robot dimaklumi karna biaya konsultasi dokter spesialisnya murah,19,worth it konsultasi online karna diagnosa akurat dokter gesa gesa template robot maklum karna biaya konsultasi dokter spesialis murah
penjelasaan sangat lengkap dan detail,5,neutral,positive,5,penjelasaan lengkap detail,3,jasa lengkap detail
baiikkk,5,neutral,positive,1,baiikkk,1,baiikkk
"tidak ada fitur kirim video, padahal penting untuk diagnosis yang tidak bisa digambarkan dengan mudah lewat kalimat. respon untuk dapet dokter lama saat lagi urgen.",1,positive,negative,28,fitur kirim video diagnosis digambarkan mudah kalimat respon dapet dokter urgen,11,fitur kirim video diagnosis gambar mudah kalimat respon dapet dokter urgen
"aplikasi ga guna !!! pake instan tulisan 1 jam sampe tapi ydh 1 jam status blom juga di ambil kurir, chat cs bilang di proses besok, gw beli di aplikasi karna butuh bgt dan ada jaminan 1 jam sampe. malah di kirim besok !!! mana ga visa cancell pula",1,negative,negative,56,aplikasi pake instan tulisan 1 jam sampe ydh 1 jam status blom ambil kurir chat cs bilang proses besok gw beli aplikasi karna butuh bgt jaminan 1 jam sampe kirim besok visa cancell,33,aplikasi pake instan tulis 1 jam sampe ydh 1 jam status blom ambil kurir chat cs bilang proses besok gw beli aplikasi karna butuh bgt jamin 1 jam sampe kirim besok visa cancell
respon dokter sangat baik .,5,neutral,positive,5,respon dokter,2,respon dokter
uang gua ditilep anying tolol,1,negative,negative,5,uang gua ditilep anying tolol,5,uang gua ditilep anying tolol
"saya bahkan belum sempat 'ngomong' , chat sdh ditutup. cuma disuruh jawab prtnyaan yg jwabannya ya tidak ya tidak doang. kolom chat tidak ada. gaje banget 45 rb tidak worth it. i got nothing.",1,neutral,negative,40,ngomong chat sdh ditutup disuruh prtnyaan jwabannya doang kolom chat gaje 45 rb worth it i got nothing,18,ngomong chat sdh tutup suruh prtnyaan jwabannya doang kolom chat gaje 45 rb worth it i got nothing
dokter pribadi sering tidak tersedia jika pakai asuransi. saat laporan juga cs nya sangat tidak membantu.,1,positive,negative,18,dokter pribadi tersedia pakai asuransi laporan cs membantu,8,dokter pribadi sedia pakai asuransi lapor cs bantu
jadi plong setelah konsul. semoga anak saya berhasil operasinya,5,positive,positive,10,plong konsul semoga anak berhasil operasinya,6,plong konsul moga anak hasil operasi
belum jugah bertnya udah habis waktunya,1,negative,negative,6,jugah bertnya habis,3,jugah bertnya habis
sangat baik dan ramah,5,positive,positive,4,ramah,1,ramah
"dokter yg sangat ramah, penjelasan detail. saya sangat puas konsultasi sama dokter",5,negative,positive,14,dokter ramah penjelasan detail puas konsultasi dokter,7,dokter ramah jelas detail puas konsultasi dokter
"respon yg sngat baik,dan memuaskn",5,positive,positive,7,respon sngat baikdan memuaskn,4,respon sngat baikdan memuaskn
dokter sangat baik dan sangat jelas saat menjelaskan,5,negative,positive,8,dokter,1,dokter
good respon,5,neutral,positive,2,good respon,2,good respon
membantu menenangkan hati,5,negative,positive,3,membantu menenangkan hati,3,bantu tenang hati
ramah cepat baik.. terimakasih dokter,5,neutral,positive,6,ramah cepat terimakasih dokter,4,ramah cepat terimakasih dokter
mantap,5,negative,positive,1,mantap,1,mantap
pasien lebih sedikit bisa berbicara mengenai keluhannya,4,neutral,positive,7,pasien berbicara keluhannya,3,pasien bicara keluh
sangat membantu,5,negative,positive,2,membantu,1,bantu
terima kasih,5,neutral,positive,2,terima kasih,2,terima kasih
lumayan,4,neutral,positive,1,lumayan,1,lumayan
lumayan..meski agak lama..tinggal nunggu kasiat obatnya,4,negative,positive,10,lumayanmeski lamatinggal nunggu kasiat obatnya,5,lumayanmeski lamatinggal nunggu kasiat obat
cepat respon nya,5,neutral,positive,3,cepat respon,2,cepat respon
kenapa aku gk bisa login,3,neutral,neutral,5,gk login,2,gk login
sangat membantu,5,negative,positive,2,membantu,1,bantu
semoga cepat menanggapi,4,negative,positive,3,semoga cepat menanggapi,3,moga cepat tanggap
bagus,5,neutral,positive,1,bagus,1,bagus
mksh udah sarannya,5,neutral,positive,3,mksh sarannya,2,mksh saran
"baik, cepet merespon suka",5,negative,positive,5,cepet merespon suka,3,cepet merespon suka
aplikasi penipu dana refund saya dijanjikan 3 hari kerja namun sudah 7 hari kerja tidak kunjung kembali.,1,positive,negative,18,aplikasi penipu dana refund dijanjikan 3 kerja 7 kerja kunjung,10,aplikasi tipu dana refund janji 3 kerja 7 kerja kunjung
"bayarnya cuma bisa pakai gopay, ribett",1,neutral,negative,7,bayarnya pakai gopay ribett,4,bayar pakai gopay ribett
bu dokter sangat cepat responya terimakasih alodokter,5,negative,positive,7,bu dokter cepat responya terimakasih alodokter,6,bu dokter cepat responya terimakasih alodokter
kata nya kirim kata sandi padahal dari kemarin kata sandi nya ngak ke kirim,1,neutral,negative,14,kirim sandi kemarin sandi ngak kirim,6,kirim sandi kemarin sandi ngak kirim
"parah bgttt office penjualan nya refund an sampe seminggu ga dibalik balikin, pesenan seminggu ga sampe sampe, setiap ditanya jawab nya tunggu tunggu tapi ga ada tindakan sampe muakkk!!!",1,positive,negative,34,parah bgttt office penjualan refund an sampe seminggu dibalik balikin pesenan seminggu sampe sampe tunggu tunggu tindakan sampe muakkk,19,parah bgttt office jual refund an sampe minggu balik balikin sen minggu sampe sampe tunggu tunggu tindak sampe muakkk
penjelasan sangat mendetil,5,neutral,positive,3,penjelasan mendetil,2,jelas mendetil
sangat puas sekali,5,neutral,positive,3,puas,1,puas
jagat bermanfaat bagi orang lain pak dokter,3,neutral,neutral,7,jagat bermanfaat orang dokter,4,jagat manfaat orang dokter
ramah,5,positive,positive,1,ramah,1,ramah
udah diresepin sama dokter pas mau pesen dimasukin keranjang ko ga bisa2 padahal lagi butuh bgt,3,positive,neutral,16,diresepin dokter pas pesen dimasukin keranjang ko bisa2 butuh bgt,10,diresepin dokter pas sen dimasukin keranjang ko bisa2 butuh bgt
bagaimana cara mengatasi flek darah saat hamil muda,5,neutral,positive,8,mengatasi flek darah hamil muda,5,atas flek darah hamil muda
oke,5,neutral,positive,1,oke,1,oke
"apk jelek, stuck di logo doang",1,negative,negative,7,apk jelek stuck logo doang,5,apk jelek stuck logo doang
parah bgt hati2 klo ada sales yg mau daftarin halodoc dgn minta no ktp dan no rek itu jd berlangganan otomatis. atm kalian bakalan kesedot 39ribu setiap bulannya dan gbisa di batalkan. parah sih ini sales kaga ada komfirmasi soal ini . aplikasi maling duit ini . konsultasi jarang duit d atm di potong 39rb setiap bln nya dunia akhirat kaga ridho !!!,1,positive,negative,67,parah bgt hati2 klo sales daftarin halodoc dgn no ktp no rek jd berlangganan otomatis atm kesedot 39ribu bulannya gbisa batalkan parah sih sales kaga komfirmasi aplikasi maling duit konsultasi jarang duit d atm potong 39rb bln dunia akhirat kaga ridho,41,parah bgt hati2 klo sales daftarin halodoc dgn no ktp no rek jd langgan otomatis atm sedot 39ribu bulan gbisa batal parah sih sales kaga komfirmasi aplikasi maling duit konsultasi jarang duit d atm potong 39rb bln dunia akhirat kaga ridho
bagus,5,neutral,positive,1,bagus,1,bagus
sangat bagus bisa dapat info ttg kesehatan ,5,negative,positive,7,bagus info ttg kesehatan,4,bagus info ttg sehat
"cepat, mudah dan efesiensi waktu",5,positive,positive,6,cepat mudah efesiensi,3,cepat mudah efesiensi
dr sangat baik membatu sekali,5,positive,positive,5,membatu,1,batu
dokter menjawab dgn totalitas,5,negative,positive,4,dokter dgn totalitas,3,dokter dgn totalitas
mantap btul...,5,negative,positive,3,mantap btul,2,mantap btul
sangat ramah dan baik,5,positive,positive,4,ramah,1,ramah
"keterangan jawaban dari dokternya mudah dipahami, fast respon",4,positive,positive,9,keterangan dokternya mudah dipahami fast respon,6,terang dokter mudah paham fast respon
"sangat membantu ,dokter menjelaskan dengan sangat baik ",5,neutral,positive,8,membantu dokter,2,bantu dokter
cepat respont . sangat detail . dan ok,5,positive,positive,8,cepat respont detail ok,4,cepat respont detail ok
terimakasih ya dok suyanti sudah mau cepat dan baik menanggapi saya,5,neutral,positive,11,terimakasih suyanti cepat menanggapi,4,terimakasih suyanti cepat tanggap
sat puas. dan baik,5,neutral,positive,5,sat puas,2,sat puas
"parah nih gak kaya apk sebelah, ini pas lg chat gak ada jawaban selama.10 menit langsung menghilang aja, keren banget ya ambil keuntungannya!!!!",1,neutral,negative,29,parah nih kaya apk sebelah pas lg chat selama10 menit langsung menghilang keren ambil keuntungannya,15,parah nih kaya apk belah pas lg chat selama10 menit langsung hilang keren ambil untung
oke,5,neutral,positive,1,oke,1,oke
membantu sekali,5,negative,positive,2,membantu,1,bantu
dokter ramah,4,negative,positive,2,dokter ramah,2,dokter ramah
"pengiriman obat gak jelas,masak hampir 24 jam harus nahan sakit krn obat blm datang.padahal dikota sini banyak apotik besar,knp dikirim dr luar kota.",1,negative,negative,28,pengiriman obat jelasmasak 24 jam nahan sakit krn obat blm datangpadahal dikota apotik besarknp dikirim kota,16,kirim obat jelasmasak 24 jam nahan sakit krn obat blm datangpadahal kota apotik besarknp kirim kota
"mudah di pahami, doktenya baik, dan cepat balasnya",5,positive,positive,10,mudah pahami doktenya cepat balasnya,5,mudah paham doktenya cepat balas
tidak informasi. mengecewakan,1,neutral,negative,4,informasi mengecewakan,2,informasi kecewa
"sangat membantu, dokternya cepat respon .",5,negative,positive,7,membantu dokternya cepat respon,4,bantu dokter cepat respon
"respon dokternya cepat banget , sangat membantu sekali ",5,negative,positive,8,respon dokternya cepat membantu,4,respon dokter cepat bantu
kukira gratis untuk masyarakat ujung ujungnya malah bayar dahlah kesebelah aja,1,neutral,negative,11,kukira gratis masyarakat ujung ujungnya bayar dahlah kesebelah,8,kira gratis masyarakat ujung ujung bayar dah belah
"aplikasi gembel sudah masukan kode otp tidak bisa next, stuck di otpt",1,negative,negative,13,aplikasi gembel masukan kode otp next stuck otpt,8,aplikasi gembel masuk kode otp next stuck otpt
"cepat respot ,baik",5,positive,positive,4,cepat respot,2,cepat respot
tiba2 autodebit 49k pdahal saya ga pernah daftar apa apa,1,positive,negative,10,tiba2 autodebit 49k pdahal daftar,5,tiba2 autodebit 49k pdahal daftar
oke,5,neutral,positive,1,oke,1,oke
sejauh ini bagus sih dokternya,5,negative,positive,5,bagus sih dokternya,3,bagus sih dokter
pelayanan yg sangat baik dalam kesehatan,5,negative,positive,6,pelayanan kesehatan,2,layan sehat
sangat membantu,5,negative,positive,2,membantu,1,bantu
responnya cepat dan sangat terbantu,5,negative,positive,5,responnya cepat terbantu,3,responnya cepat bantu
"saya pesan obat bayar transfer bank malah gagal ,ajukan refund sudah trs penahanan dana 3 hri kerja blm tanggal libur serta merah gk dihitung dan belum dikembalikan sampe sekarang,tidak jujur tidak bertanggung jawab ,kecewa banget jadinya kapok",1,neutral,negative,41,pesan obat bayar transfer bank gagal ajukan refund trs penahanan dana 3 hri kerja blm tanggal libur merah gk dihitung dikembalikan sampe sekarangtidak jujur bertanggung kecewa kapok,27,pesan obat bayar transfer bank gagal aju refund trs tahan dana 3 hri kerja blm tanggal libur merah gk hitung kembali sampe sekarangtidak jujur tanggung kecewa kapok
lebih mempersulit orang lain,1,neutral,negative,4,mempersulit orang,2,sulit orang
dokter sangat baikk,5,positive,positive,3,dokter baikk,2,dokter baikk
kami senang dengan pelayanan allo dr yang sangat membatu untuk kesehatan sekluarga kami dengan pelayanan yang sangat baik dan berguna bagi penguna nya apa ini membantu(ya) (tidak),3,neutral,neutral,32,senang pelayanan allo membatu kesehatan sekluarga pelayanan berguna penguna membantuya,10,senang layan allo batu sehat sekluarga layan guna penguna membantuya
good lah,5,neutral,positive,2,good,1,good
sangat puas dg jwban dri dokter,5,positive,positive,6,puas dg jwban dri dokter,5,puas dg jwban dri dokter
sangat membantu,5,negative,positive,2,membantu,1,bantu
sangat membantu,5,negative,positive,2,membantu,1,bantu
membantu,5,negative,positive,1,membantu,1,bantu
respon sangat baik,5,negative,positive,3,respon,1,respon
"respon cepat, penjelasan jelas dan memuaskan",5,neutral,positive,7,respon cepat penjelasan memuaskan,4,respon cepat jelas muas
bagus,4,neutral,positive,1,bagus,1,bagus
masih terpitong krn salah pencet,5,negative,positive,5,terpitong krn salah pencet,4,terpitong krn salah pencet
best,5,neutral,positive,1,best,1,best
bagus dokter nya sangat informatif dan baik penjelasannya,5,neutral,positive,8,bagus dokter informatif penjelasannya,4,bagus dokter informatif jelas
mendidik informatif,5,neutral,positive,2,mendidik informatif,2,didik informatif
dokter nya cepat banget balas nya..mantap,5,neutral,positive,8,dokter cepat balas nyamantap,4,dokter cepat balas nyamantap
"respons cepat, mudah²an sembuh. thanks dok",5,negative,positive,8,respons cepat mudah²an sembuh thanks,5,respons cepat mudah an sembuh thanks
dokter responx cepat dan ramah,5,negative,positive,5,dokter responx cepat ramah,4,dokter responx cepat ramah
terima kasih dok informasi dan bantuanya,4,neutral,positive,6,terima kasih informasi bantuanya,4,terima kasih informasi bantuanya
"puas,,dengan semua jawaban dokter",5,neutral,positive,6,puasdengan dokter,2,puasdengan dokter
"sy suka aplikasi ini, untuk bisa tau macam macam penyakit terima kasih",5,neutral,positive,13,sy suka aplikasi tau penyakit terima kasih,7,sy suka aplikasi tau sakit terima kasih
aplikasi responsif dan mudah digunakan,5,neutral,positive,5,aplikasi responsif mudah,3,aplikasi responsif mudah
good,5,neutral,positive,1,good,1,good
apakah dexanta aman untuk ibu menyusui,5,positive,positive,6,dexanta aman menyusui,3,dexanta aman susu
